IDhotel,NameHotel,Location
180,Khu nghỉ dưỡng Mercure Đà Lạt,Đà Lạt
23,Azura Gold Hotel & Apartment,Nha Trang
288,Khách sạn Marina Bay Côn Đảo,Vũng Tàu
116,Hội An Memories Resort & Spa,Hội An
132,Khu Nghỉ Dưỡng Radisson Phan Thiết,Phan Thiết
106,Hue Sweethouse 1 Homestay,Huế
135,Khu Nghỉ Dưỡng Zen Valley Đà Lạt,Đà Lạt
280,Khách sạn Lasol Boutique Đà Lạt,Đà Lạt
184,Khu nghỉ dưỡng Movenpick Phan Thiết,Phan Thiết
174,Khu nghỉ dưỡng Le Viva Mũi Né,Phan Thiết
370,Khách sạn Wyndham Garden Grandworld Phú Quốc,Phú Quốc
70,Flower Boutique Hotel,Đà Nẵng
254,Khách sạn Grand Hyams Quy Nhơn,Quy Nhơn
142,Khu nghỉ dưỡng ALMA Cam Ranh,Nha Trang
419,Mi Nhon Em Hotel Muine,Phan Thiết
467,RAON Hotel - STAY 24H,Quy Nhơn
440,Nam Thu Hotel,Quy Nhơn
80,Hai Yen Family Resort,Phan Thiết
514,Swandor Cam Ranh Hotels & Resorts,Nha Trang
213,Khu nghỉ dưỡng The Anam Mũi Né,Phan Thiết
368,Khách sạn Vipol Mũi Né,Phan Thiết
140,Khu nghỉ The Arena Cam Ranh,Nha Trang
581,TTC Imperial Hotel,Huế
582,Gold Hotel Hue,Huế
583,Masova Hotel ,Nha Trang
584,The Anam Cam Ranh,Nha Trang
585,Hon Tam Resort,Nha Trang
586,Mövenpick Villas & Residences Phu Quoc,Phú Quốc
587,Grand Hyams Hotel Quy Nhon Beach,Quy Nhơn
588,MENTO HOTEL QUY NHƠN,Quy Nhơn
589,Song Suoi Homestay,Quy Nhơn
590,Ana Mandara Cam Ranh,Nha Trang
591,Khu nghỉ dưỡng Pilgrimage Village Boutique,Huế
592,ZEN RETREAT HOI AN, Hội An
593,Amora Hotel & Apartment Vung Tau,Vũng Tàu
594,QUE HUONG HOTEL, Quy Nhơn
595,Hotel 86 Phan Thiết,Phan Thiết