IDhotel,NameHotel,Location
277,Khách sạn La Sapinette Đà Lạt,Đà Lạt
256,Khách sạn Green Vũng Tàu,Vũng Tàu
171,Khu nghỉ dưỡng Kim Hoa Phú Quốc,Phú Quốc
182,Khu nghỉ dưỡng Minh Tâm Beach Phan Thiết,Phan Thiết
150,Khu nghỉ dưỡng Arcadia Phú Quốc,Phú Quốc
350,Khách sạn TTC - Ngọc Lan Đà Lạt,Đà Lạt
378,Khách sạn Đà Lạt Palace Heritage,Đà Lạt
366,Khách sạn Vietsovpetro Đà Lạt,Đà Lạt
308,Khách sạn Mường Thanh Đà Lạt,Đà Lạt
552,Vedana Lagoon Resort & Spa Huế,Huế
205,Khu nghỉ dưỡng Seaside Vũng Tàu,Vũng Tàu
141,Khu nghỉ dưỡng & biệt thự Sanctuary Hồ Tràm,Vũng Tàu
334,Khách sạn Rum Vàng Đà Lạt,Đà Lạt
359,Khách sạn Thi Thảo - Gardenia Đà Lạt,Đà Lạt
460,Pilgrimage Village Resort & Spa Huế,Huế
236,Khách sạn Corvin Vũng Tàu,Vũng Tàu
252,Khách sạn Gold Đà Nẵng,Đà Nẵng
329,Khách sạn Romeliess Vũng Tàu,Vũng Tàu
269,The IMPERIAL Vung Tau Hotel,Vũng Tàu
202,Khu nghỉ dưỡng Rock Water Bay Phan Thiết,Phan Thiết
530,The Cliff Resort & Residences Phan Thiết,Phan Thiết
188,Khu nghỉ dưỡng Novela Phan Thiết,Phan Thiết
404,Lys Villa Đà Lạt ( tên cũ Reveto Villa Đà Lạt),Đà Lạt
185,Khu nghỉ dưỡng Muine Bay Phan Thiết,Phan Thiết
372,Khách sạn Yasaka Sài Gòn Nha Trang,Nha Trang
260,Khách sạn Hoa Sen 62 Đà Lạt,Đà Lạt
179,Khu nghỉ dưỡng MerPerle Hòn Tằm Nha Trang,Nha Trang
231,Khách sạn Brilliant Đà Nẵng,Đà Nẵng
317,Khách sạn Park Đà Lạt,Đà Lạt
270,Khách sạn Indochine Palace Huế,Huế
351,Khách sạn TTC Premium - Michelia Nha Trang,Nha Trang
349,Khách sạn Sài Gòn Đà Lạt,Đà Lạt
559,Villa Del Sol Beach Resort  & Spa Phan Thiết,Phan Thiết
340,Khách sạn Saphir Đà Lạt,Đà Lạt
76,Green Field Villas Hội An,Hội An
7,Allezboo Beach Resort & Spa Phan Thiết,Phan Thiết
330,Khách sạn Rosaleen Boutique Huế,Huế
114,Hương Giang Hotel Resort & Spa Huế,Huế
476,Romana Resort & Spa Phan Thiết,Phan Thiết
192,Khu nghỉ dưỡng Palm Garden Beach Hội An,Hội An
146,Khu nghỉ dưỡng Ana Mandara Villas Dalat Resort and Spa,Đà Lạt
347,Khách sạn Sun City Nha Trang,Nha Trang
490,Sea Links Beach Villas Phan Thiết,Phan Thiết
164,Khu nghỉ dưỡng Furama Đà Nẵng,Đà Nẵng
298,Khách sạn Mường Thanh Grand Nha Trang,Nha Trang
160,Khu nghỉ dưỡng Edensee Lake Resort & Spa Đà Lạt,Đà Lạt
310,Khách sạn Ngọc Mai Phú Đà Lạt,Đà Lạt
300,Khách sạn Mường Thanh Holiday Huế,Huế
215,Khu nghỉ dưỡng The Sailing Bay Beach Phan Thiết,Phan Thiết
299,Khách sạn Mường Thanh Grand Đà Nẵng,Đà Nẵng
149,Khu nghỉ dưỡng Angsana Lăng Cô Huế,Huế
211,Khu nghỉ dưỡng TTC Premium Kê Gà,Phan Thiết
371,Khách sạn Xuân Hồng 2 Đà Lạt,Đà Lạt
237,Khách sạn Cẩm Tú Cầu Đà Lạt,Đà Lạt
109,Huế Riverside Boutique Resort & Spa,Huế
363,Khách sạn Tâm Dung Đà Lạt,Đà Lạt
251,Khách sạn Gold Coast Đà Nẵng,Đà Nẵng
556,Victoria Phan Thiết Beach Resort & Spa,Phan Thiết
152,Khu nghỉ dưỡng Carmelina Beach Hồ Tràm,Vũng Tàu
168,Khu nghỉ dưỡng Hội An Beach,Hội An
31,Biệt thự Khánh Lâm Đà Lạt,Đà Lạt
405,Làng Biệt thự Osaka Đà Lạt,Đà Lạt
242,Khách sạn Eldora Huế,Huế
225,Khách sạn A La Carte Đà Nẵng,Đà Nẵng
379,Khách sạn Đông Xuân Hồng Phú Quốc,Phú Quốc
193,Khu nghỉ dưỡng Pandanus Phan Thiết,Phan Thiết
65,Famiana Resort & Spa Phú Quốc,Phú Quốc
271,Khách sạn InterContinental Grand Hồ Tràm,Vũng Tàu
128,Khu Nghỉ Dưỡng La Mer Phú Quốc,Phú Quốc
267,Khách sạn Imperial Huế,Huế
309,Khách sạn New Wave Vũng Tàu,Vũng Tàu
136,Khu Nghỉ Dưỡng Đồi Mộng Mơ Đà Lạt,Đà Lạt
204,Khu nghỉ dưỡng Sandy Beach Non Nước Đà Nẵng,Đà Nẵng
341,Khách sạn Sea Links Beach Phan Thiết,Phan Thiết
191,Khu nghỉ dưỡng Ocean Dunes Phan Thiết,Phan Thiết
352,Khách sạn TTC Premium Phan Thiết,Phan Thiết
30,Biệt Thự Hoa Hồng Đà Lạt (Dalat Terrasse Des Roses Villa),Đà Lạt
274,Khách sạn King's Finger Đà Nẵng,Đà Nẵng
216,Khu nghỉ dưỡng Vietsovpetro Hồ Tràm,Vũng Tàu
115,Hồ Tràm Beach Boutique Resort & Spa,Vũng Tàu
540,The Shells Resort & Spa Phu Quoc,Phú Quốc
361,Khách sạn Thông Đỏ Đà Lạt,Đà Lạt
95,Holiday Beach Đà Nẵng Hotel & Resort,Đà Nẵng
27,BELLA VT HOTEL,Vũng Tàu
284,Khách sạn Majestic Nha Trang,Nha Trang
447,Nolis Hotel Vung Tau,Vũng Tàu
232,Khách sạn Brown Bean,Đà Nẵng
413,Melissa Hotel Nha Trang,Nha Trang
54,Dalat Home Villa,Đà Lạt
163,Khu nghỉ dưỡng Four Seasons The Nam Hải Hội An,Hội An
480,Rạng Garden Beach Side Resort,Phan Thiết
397,Le Soleil Nha Trang Hotel,Nha Trang
333,Khách sạn Royal Vũng Tàu,Vũng Tàu
412,Melia Hồ Tràm Beach Resort,Vũng Tàu
118,Hội An Việt House Homestay,Hội An
138,Khu nghỉ dưỡng Risemount Premier Đà Nẵng,Đà Nẵng
19,Aroma Nha Trang Boutique Hotel,Nha Trang
544,TinTin Hostel,Huế
302,Khách sạn Mường Thanh Holiday Mũi Né,Phan Thiết
479,Royal Dalat Hotel,Đà Lạt
542,The Sunriver Boutique Hotel Hue,Huế
456,Phan Thiet Ocean Dunes Resort,Phan Thiết
497,Seaside Resort Vung Tau,Vũng Tàu
220,Khách Sạn Hoài Niệm Hội An,Hội An
457,Pho Hoi 1 Hotel,Hội An
321,Khách sạn Poetic Huế,Huế
319,Phuong Dong Hotel and Apartment,Quy Nhơn
227,Khách sạn ANYA Quy Nhơn,Quy Nhơn
86,Hoang Yen Canary Hotel Quy Nhon,Quy Nhơn
343,Khách sạn Senkotel Nha Trang,Nha Trang
431,Muong Thanh Luxury Khanh Hoa,Nha Trang
521,TTC Hotel Phan Thiet,Phan Thiết
328,Khách sạn Riva Vũng Tàu,Vũng Tàu
452,Oceanami Villas & Beach Club Long Hải,Vũng Tàu
69,Flora Hotel Hue,Huế
50,DMZ Hotel,Huế
322,Khách sạn Premier Havana Nha Trang,Nha Trang
449,O.Six Resort,Quy Nhơn
262,Khách sạn Hoàng Yến 1 Quy Nhơn,Quy Nhơn
395,Le House Boutique Hotel,Đà Nẵng
487,Sandunes Beach Resort and Spa,Phan Thiết
307,Khách sạn Mường Thanh Quy Nhơn,Quy Nhơn
172,Khu nghỉ dưỡng Lan Rừng Phước Hải,Vũng Tàu
537,The Palmy Phú Quốc Resort & Spa,Phú Quốc
74,Golden Bell Backpacker Hotel & Pool Bar,Hội An
475,Rex Hotel and Apartment,Nha Trang
392,La Vague Hotel Nha Trang,Nha Trang
97,Hong Diep Hotel Quy Nhon,Quy Nhơn
357,Khách sạn The Luxe Đà Lạt,Đà Lạt
338,Khách sạn San Hô Vũng Tàu,Vũng Tàu
73,Gold Ocean Apartments Nha Trang,Nha Trang
294,Khách sạn Minh Hùng,Phan Thiết
82,Halona Hotel Phu Quoc,Phú Quốc
5,Alibaba Hotel,Đà Nẵng
417,Mercure Danang French Village Bana Hills,Đà Nẵng
356,Khách sạn The Cap Vũng Tàu,Vũng Tàu
474,Resort Poshanu,Phan Thiết
75,Golden River Hotel,Hội An
55,Dalat Wonder Resort,Đà Lạt
117,Hội An Reverie Villas,Hội An
515,Swiss-Belresort Tuyền Lâm - Đà Lạt,Đà Lạt
318,Khách sạn Phương Uyên Đà Lạt,Đà Lạt
332,Khách sạn Royal Charm,Đà Nẵng
533,The Grace Hotel Dalat,Đà Lạt
249,Khách sạn Fusion Suites Vũng Tàu,Vũng Tàu
87,Hoi An Canal House,Hội An
403,Ly Ky Hotel,Quy Nhơn
43,Cherish Hotel Hue,Huế
573,Vuong Gia Hotel,Đà Lạt
57,Delight Hotel,Quy Nhơn
367,Khách sạn VinHolidays Fiesta Phú Quốc,Phú Quốc
212,Terracotta Hotel & Resort Dalat,Đà Lạt
513,Surf4You Residence,Phan Thiết
13,Angel Hotel Danang,Đà Nẵng
430,Muong Thanh Grand Da Nang Hotel,Đà Nẵng
548,V Hotel Nha Trang,Nha Trang
557,Victorian Hotel Dalat,Đà Lạt
94,Holi Panorama Nha Trang,Nha Trang
301,Khách sạn Mường Thanh Holiday Hội An,Hội An
305,Khách sạn Mường Thanh Luxury Phú Quốc,Phú Quốc
111,Hôtel Colline,Đà Lạt
8,Amona Hotel,Huế
441,Nam Xuan Premium Hotel,Đà Lạt
401,Lotus Village Resort Mui Ne,Phan Thiết
561,VinOasis Phu Quoc,Phú Quốc
380,King House Villa Hotel & Spa,Đà Nẵng
320,Khách sạn Phố Núi Đà Lạt,Đà Lạt
279,Khách sạn Lasenta Boutique Hội An,Hội An
113,Hưng Nguyên Valley Đà Lạt,Đà Lạt
263,Khách sạn Hải Duyên Đà Lạt,Đà Lạt
549,VARIA Hotel,Phú Quốc
21,Avani Quy Nhơn Resort & Spa,Quy Nhơn
355,Khách sạn Thanh Lịch Royal Boutique Huế,Huế
22,Azerai Ke Ga Bay,Phan Thiết
386,La Beach Hotel,Đà Nẵng
496,Seashore Hotel & Apartment,Đà Nẵng
323,Khách sạn Premier Pearl Vũng Tàu,Vũng Tàu
421,Minera Hot Springs Bình Châu (Khoáng Nóng Thiên Nhiên Bình Châu),Vũng Tàu
420,Milan Homestay - The Song Vung Tau,Vũng Tàu
137,Pilgrimage Village Boutique Resort & Spa,Huế
286,Khách sạn Majestic Star Nha Trang,Nha Trang
129,Lahana Resort Phu Quoc & Spa,Phú Quốc
56,Davue Hotel Da Nang,Đà Nẵng
33,Blue Sea Hotel Quy Nhon,Quy Nhơn
304,Muong Thanh Luxury Nha Trang Hotel,Nha Trang
539,The Secret Garden,Đà Nẵng
296,Khách sạn Minh Đăng Vũng Tàu,Vũng Tàu
414,Menora Grand Đà Nẵng,Đà Nẵng
15,Annata Beach Hotel,Vũng Tàu
14,Anio Boutique Hotel Hoi An,Hội An
122,Jade Scene Hotel,Huế
437,Mũi Né Boutique Hotel,Phan Thiết
568,Vinpearl Resort Nha Trang - Hon Tre Island,Nha Trang
504,Smile Hotel Nha Trang,Nha Trang
555,Victoria Hội An Beach Resort & Spa,Hội An
427,Mira Hotel Quy Nhơn,Quy Nhơn
566,Vinpearl Resort & Spa Phú Quốc,Phú Quốc
289,Melia Vinpearl Hue,Huế
42,Cereja Hotel & Resort Đà Lạt,Đà Lạt
567,Vinpearl Resort Nha Trang,Nha Trang
428,Moonlight Hotel Hue,Huế
524,Than Thien Friendly Hotel,Huế
520,TTC Hotel - Hoi An,Hội An
415,Mento Hotel Quy Nhon,Quy Nhơn
258,Khách sạn Happy Day Đà Lạt,Đà Lạt
276,Khách sạn Kova Diamond Đà Nẵng,Đà Nẵng
311,Khách sạn Ngọc Phát Đà Lạt,Đà Lạt
266,Khách sạn Hồng Tâm Đà Lạt,Đà Lạt
34,Blue Sky Phú Quốc Hotel,Phú Quốc
98,Hong Thien 1 Hotel,Huế
354,Khách sạn Thanh Bình 2,Hội An
525,Thanh Binh Central Hotel,Hội An
360,Khách sạn Tháng Mười,Vũng Tàu
536,The Nam An Villa Hoi An,Hội An
458,Phong Nha Hotel Hue,Huế
297,Khách sạn Modern Sky Nha Trang,Nha Trang
337,Khách sạn Sammy Đà Lạt,Đà Lạt
90,Hoi An River Beach Resort and Residences,Hội An
398,Linh Dan Bungalow,Phú Quốc
394,Larita Da Lat Boutique Hotel,Đà Lạt
553,Venus Hotel & Sky Bar Phu Quoc,Phú Quốc
123,K Boutique Hotel in Dalat,Đà Lạt
41,Century Riverside Hue,Huế
507,Song Homestay - The Song Vung Tau,Vũng Tàu
265,Khách sạn Hồng Hải Đà Lạt,Đà Lạt
481,S Bungalow Phu Quoc,Phú Quốc
546,Tuấn Vũ Homestay,Đà Lạt
261,Khách sạn Hoàng Yến,Vũng Tàu
243,Khách sạn Empress Đà Lạt,Đà Lạt
92,Hoi An Rose Garden Hotel,Hội An
373,Khách sạn Zalo Sea,Đà Nẵng
558,Vietsovpetro Resort,Vũng Tàu
29,Biệt Thự  Hoa Trà Đà Lạt,Đà Lạt
495,Seashells Phú Quốc Hotel & Spa,Phú Quốc
348,Khách sạn Sunny Đà Lạt,Đà Lạt
198,Khu nghỉ dưỡng Pullman Đà Nẵng Beach,Đà Nẵng
273,Khách sạn Iris Đà Lạt,Đà Lạt
444,"Nha Trang Marriott Resort & Spa, Hon Tre Island",Nha Trang
206,Khu nghỉ dưỡng Seava Hồ Tràm,Vũng Tàu
565,Vinpearl Resort & Spa Nha Trang Bay,Nha Trang
233,Khách sạn Bưu Điện Vũng Tàu,Vũng Tàu
461,Pontus Hotel,Đà Lạt
451,Ocean Vista Sea Links Phan Thiết,Phan Thiết
255,Khách sạn Grand Sea Đà Nẵng,Đà Nẵng
336,Khách sạn Sammy Vũng Tàu,Vũng Tàu
230,Khách sạn Arapang Đà Lạt,Đà Lạt
377,Khách sạn ÊMM Hội An,Hội An
400,Lotus Rock Hotel,Đà Nẵng
139,Khu nghỉ dưỡng và Spa Mikazuki Nhật Bản,Đà Nẵng
511,Sunny Beach Resort & Spa Phan Thiết,Phan Thiết
161,Khu nghỉ dưỡng FLC Luxury Quy Nhơn,Quy Nhơn
250,Khách sạn Giai Điệu Đà Lạt,Đà Lạt
385,La An Central Boutique Villa,Hội An
502,Sheraton Phú Quốc Long Beach Resort,Phú Quốc
102,Hotel La Perle,Huế
446,Nohana Hotel (Former Y Khoa Hotel),Phan Thiết
222,Khách Sạn Malibu Beach Vũng Tàu,Vũng Tàu
71,GIC Luxury Hotel And Spa,Đà Nẵng
189,Khu nghỉ dưỡng Novotel Phú Quốc,Phú Quốc
418,Mercury Phú Quốc Resort & Villas,Phú Quốc
282,Khách sạn Liberty Central Nha Trang,Nha Trang
120,InterContinental Đà Nẵng Sun Peninsula Resort,Đà Nẵng
12,Anantara Resort & Spa Mũi Né,Phan Thiết
275,Khách sạn Kings Đà Lạt,Đà Lạt
228,Khách sạn Alana Nha Trang,Nha Trang
303,Khách sạn Mường Thanh Holiday Vũng Tàu,Vũng Tàu
272,Khách sạn InterContinental Nha Trang,Nha Trang
523,Terracotta Resort & Spa Phan Thiết,Phan Thiết
240,Khách sạn Du Parc Đà Lạt,Đà Lạt
365,Khách sạn Victory Đà Lạt,Đà Lạt
327,Khách sạn Rex Vũng Tàu,Vũng Tàu
25,Bamboo Village Beach Resort & Spa Mũi Né,Phan Thiết
158,Khu nghỉ dưỡng Dankbaar Quy Nhơn,Quy Nhơn
223,Khách Sạn Stop And Go Boutique Đà Lạt,Đà Lạt
560,Villa T89 Đà Lạt,Đà Lạt
493,Seahorse Resort & Spa Phan Thiết,Phan Thiết
246,Khách sạn FLC Luxury Quy Nhơn,Quy Nhơn
167,Khu nghỉ dưỡng Hải Dương Intourco Vũng Tàu,Vũng Tàu
67,Fireworks Homestay,Hội An
201,Khu nghỉ dưỡng Risemount Premier Đà Nẵng,Đà Nẵng
145,Khu nghỉ dưỡng Amiana Nha Trang,Nha Trang
342,Khách sạn Seagull Quy Nhơn,Quy Nhơn
324,Khách sạn Pullman Vũng Tàu,Vũng Tàu
178,Khu nghỉ dưỡng Meliá Vinpearl Phú Quốc,Phú Quốc
121,JW Marriott Phu Quoc Emerald Bay Resort & Spa,Phú Quốc
177,Khu nghỉ dưỡng Meliá Vinpearl Cam Ranh Beach,Nha Trang
200,Radisson Blu Resort Phu Quoc,Phú Quốc
110,Hyatt Regency Đà Nẵng Resort & Spa,Đà Nẵng
153,Casa Marina Resort,Quy Nhơn
376,Khách sạn ÊMM Huế,Huế
278,Khách sạn Lake View Đà Lạt,Đà Lạt
224,Khách Sạn Tùng Hương Phú Quốc,Phú Quốc
532,The Garden Hotel and Apartment,Đà Nẵng
162,Khu nghỉ dưỡng Fleur de Lys Long Hải,Vũng Tàu
133,Khu Nghỉ Dưỡng Tiến Đạt Mũi Né,Phan Thiết
37,Cam Ranh Riviera Beach Resort & Spa,Nha Trang
181,Khu nghỉ dưỡng Mia Nha Trang,Nha Trang
144,Khu nghỉ dưỡng Amarin Phú Quốc,Phú Quốc
159,Khu nghỉ dưỡng Duyên Hà Cam Ranh,Nha Trang
165,Khu nghỉ dưỡng Fusion Cam Ranh,Nha Trang
535,The May Hotel Phu Quoc,Phú Quốc
313,Khách sạn Novotel Nha Trang,Nha Trang
489,Sea Links Beach Resort & Golf,Phan Thiết
127,Khu Nghỉ Dưỡng Elwood Phú Quốc,Phú Quốc
210,Khu nghỉ dưỡng Six Senses Ninh Vân Bay Nha Trang,Nha Trang
264,Khách sạn Hải Âu Quy Nhơn,Quy Nhơn
462,Poulo Condor Boutique Resort & Spa Côn Đảo,Vũng Tàu
306,Khách sạn Mường Thanh Luxury Đà Nẵng,Đà Nẵng
196,Khu nghỉ dưỡng Premier Village Đà Nẵng,Đà Nẵng
203,Khu nghỉ dưỡng SOL by Meliá Phú Quốc,Phú Quốc
344,Khách sạn Star City Nha Trang,Nha Trang
438,NAM Hotel & Spa Đà Nẵng,Đà Nẵng
214,Khu nghỉ dưỡng The Anam Nha Trang,Nha Trang
501,Sheraton Nha Trang Hotel & Spa,Nha Trang
18,Aroma Beach Resort & Spa Phan Thiết,Phan Thiết
374,Khách sạn iBis Styles Nha Trang,Nha Trang
362,Khách sạn Tulip 3 Đà Lạt,Đà Lạt
235,Khách sạn Citadines Bayfront Nha Trang,Nha Trang
551,VND Hotel,Vũng Tàu
221,Khách Sạn LADALAT,Đà Lạt
369,Khách sạn Wyndham Danang Golden Bay,Đà Nẵng
564,Vinpearl Resort & Golf Nam Hội An,Hội An
78,HAIAN Beach Hotel & Spa Đà Nẵng,Đà Nẵng
170,Khu nghỉ dưỡng Intourco  Vũng Tàu,Vũng Tàu
518,TMS Hotel Đà Nẵng Beach,Đà Nẵng
248,Khách sạn Four Points by Sheraton Đà Nẵng,Đà Nẵng
49,Côn Đảo Resort,Vũng Tàu
239,Khách sạn Du Lys Đà Lạt,Đà Lạt
131,Khu Nghỉ Dưỡng Premier Residences Phú Quốc Emerald Bay,Phú Quốc
169,Khu nghỉ dưỡng InterContinental Phu Quoc Long Beach,Phú Quốc
569,Vinpearl Wonderworld Phú Quốc,Phú Quốc
17,Ariyana SmartCondotel Nha Trang,Nha Trang
285,Khách sạn Majestic Premium Nha Trang,Nha Trang
217,Khu nghỉ dưỡng Wyndham Grand Phú Quốc,Phú Quốc
291,Khách sạn Meliá Vinpearl Đà Nẵng Riverfront,Đà Nẵng
353,Khách sạn TTC – Đà Lạt,Đà Lạt
383,LAlya Ninh Vân Bay,Nha Trang
156,Khu nghỉ dưỡng Crown Retreat Quy Nhơn,Quy Nhơn
290,Khách sạn Meliá Vinpearl Nha Trang Empire,Nha Trang
316,Khách sạn Paris Deli Đà Nẵng,Đà Nẵng
53,Dalat De Charme Village,Đà Lạt
538,The Palmy Resort & Spa Phú Quốc,Phú Quốc
190,Khu nghỉ dưỡng Núi Thần Tài Ebisu Đà Nẵng,Đà Nẵng
176,Khu nghỉ dưỡng Melia Đà Nẵng Beach,Đà Nẵng
4,Alba Wellness Valley by Fusion Huế,Huế
218,Khu nghỉ dưỡng Đà Lạt Wonder,Đà Lạt
331,Khách sạn Roy Dala Đà Lạt,Đà Lạt
335,Khách sạn SALA Đà Nẵng Beach,Đà Nẵng
195,Khu nghỉ dưỡng Premier Village Phu Quoc Managed By Accor,Phú Quốc
112,Hôtel Colline Đà Lạt,Đà Lạt
253,Khách sạn Golf Valley Đà Lạt,Đà Lạt
281,Khách sạn Len's Đà Lạt,Đà Lạt
155,Khu nghỉ dưỡng Citadines Pearl Hội An,Hội An
208,Khu nghỉ dưỡng Sheraton Grand Đà Nẵng,Đà Nẵng
345,Khách sạn Stella Maris Đà Nẵng,Đà Nẵng
148,Khu nghỉ dưỡng Anantara Quy Nhơn Villas,Quy Nhơn
325,Khách sạn Queen Ann Nha Trang,Nha Trang
410,Marina Bay Resort & Spa Vũng Tàu,Vũng Tàu
562,Vinpearl Beachfront Nha Trang,Nha Trang
238,Khách sạn Dragon King 1 Đà Lạt,Đà Lạt
312,Khách sạn Nice Dream Đà Lạt,Đà Lạt
143,Khu nghỉ dưỡng Almanity Hội An Wellness,Hội An
484,Saint Simeon Resort & Spa Long Hải,Vũng Tàu
209,Khu nghỉ dưỡng Six Senses Côn Đảo,Vũng Tàu
126,Khu Nghỉ Dưỡng Best Western Premier Sonasea Phú Quốc,Phú Quốc
20,Art Nest Hotel & Apartment Nha Trang,Nha Trang
391,La Siesta Hội An Resort & Spa,Hội An
241,Khách sạn Dạ Lan 2 Đà Lạt,Đà Lạt
314,Khách sạn Novotel Đà Nẵng Premier Han River,Đà Nẵng
292,Khách sạn Mermaid Seaside Vũng Tàu,Vũng Tàu
339,Khách sạn Sandals LiLy Đà Lạt,Đà Lạt
387,La Cactus Hotel,Quy Nhơn
103,Hotel Minh Hang,Phan Thiết
473,Redhouse Dalat Hotel,Đà Lạt
463,Pullman Vung Tau,Vũng Tàu
107,Huong Giang Bungalow,Phú Quốc
375,Khách sạn ibis Styles Vũng Tàu,Vũng Tàu
571,Vung Tau Melody Apartment,Vũng Tàu
407,M Hotel Đà Lạt,Đà Lạt
40,Cen Hotel,Vũng Tàu
124,Khanh Uyen 1 Hotel,Đà Lạt
508,Sun Beach Hotel,Vũng Tàu
199,Khu nghỉ dưỡng Radisson Blu Cam Ranh,Nha Trang
416,Mercure Hotel Vũng Tàu,Vũng Tàu
408,Malibu Hotel,Vũng Tàu
381,Kings Hotel Dalat,Đà Lạt
38,Can ho Melody Vung Tau - Your Homestay,Vũng Tàu
494,Seashells Phu Quoc Hotel & Spa,Phú Quốc
36,CAMY Hotel Vung Tau,Vũng Tàu
44,Cherry Hotel & Apartment Da Nang - Phoenix 2 Hotel,Đà Nẵng
147,Khu nghỉ dưỡng Anantara Hội An,Hội An
499,Sen Hotel Phu Quoc,Phú Quốc
492,Sea Star Resort,Phú Quốc
16,Arapang Hotel 2,Đà Lạt
448,Novotel Phu Quoc Resort,Phú Quốc
576,ibis Styles Vung Tau,Vũng Tàu
100,Hotel Hoai Anh,Vũng Tàu
425,Mira Bãi Xếp Quy Nhơn - The Hidden Jewel,Quy Nhơn
509,Sun Lake Hotel,Vũng Tàu
384,LIM House,Phan Thiết
545,Tulip Mui Ne,Phan Thiết
11,An Ngân Phú Hotel,Quy Nhơn
482,SOL by Meliá Phu Quoc,Phú Quốc
183,Khu nghỉ dưỡng Movenpick Cam Ranh,Nha Trang
468,RIO Hotel and Apartment,Vũng Tàu
471,Raon Hotel - STAY 24H,Đà Nẵng
247,Khách sạn Fleur De Lys Quy Nhơn,Quy Nhơn
151,Khu nghỉ dưỡng Banyan Tree Lăng Cô Huế,Huế
485,Sala Danang Beach Hotel,Đà Nẵng
534,The Kila Boutique Hotel,Quy Nhơn
399,Little Riverside Hoi An . A Luxury Hotel & Spa,Hội An
130,Khu Nghỉ Dưỡng Movenpick Waverly Phú Quốc,Phú Quốc
226,Khách sạn ANYA Premier Quy Nhơn,Quy Nhơn
83,Hanh Huong Hostel,Phan Thiết
477,Rosaleen Boutique Hotel,Huế
207,Khu nghỉ dưỡng Selectum Noa Cam Ranh,Nha Trang
563,Vinpearl Luxury Nha Trang,Nha Trang
283,Khách sạn Lucky Sun Nha Trang,Nha Trang
579,"Đà Nẵng Marriott Resort & Spa, Non Nước Beach Villas",Đà Nẵng
268,Khách sạn Imperial Nha Trang,Nha Trang
500,Senia Hotel Nha Trang,Nha Trang
423,Minh Duc Guesthouse,Phan Thiết
527,Thanh Kieu Beach Resort,Phú Quốc
411,Marine Hotel & Apartment,Vũng Tàu
68,Fleur de Lys Hotel Quy Nhon,Quy Nhơn
48,Cô Tư's Homestay,Phan Thiết
24,BED STATION HOSTEL,Quy Nhơn
409,Mango Bay Resort,Phú Quốc
259,Khách sạn Hilton Đà Nẵng,Đà Nẵng
436,Mövenpick Villas & Residences Phu Quoc,Phú Quốc
77,HAIAN Beach Hotel & Spa,Đà Nẵng
439,Nam Phương Riverside Villa,Huế
101,Hotel Khanh An,Phan Thiết
59,Dusit Princess Moonrise Beach Resort,Phú Quốc
443,Nghĩ dưỡng Biển Ngọc,Phan Thiết
402,Lovely House,Đà Lạt
9,An Gia,Đà Lạt
45,Coral Bay Resort,Phú Quốc
435,Mövenpick Resort Waverly Phu Quoc,Phú Quốc
464,Purple Hue Central Hub,Huế
295,Khách sạn Minh Toàn Safi Ocean Đà Nẵng,Đà Nẵng
505,Sofiana My Khe Hotel & Spa,Đà Nẵng
455,Pavillon Garden Hotel Nha Trang,Nha Trang
528,Thanh Lich Royal Boutique,Huế
3,Aaron Hotel,Nha Trang
445,Nhà nghỉ Hùng Hoa,Phan Thiết
396,Le Robinet Homestay,Huế
72,Galliot Hotel,Nha Trang
51,DTX Hotel Nha Trang,Nha Trang
442,Navada Beach Hotel,Nha Trang
454,Palmier Hotel - Art House Da Nang,Đà Nẵng
459,Phuc Thanh Luxury Hotel,Đà Nẵng
358,Khách sạn The Secret Côn Đảo,Vũng Tàu
219,Khách Sạn Flower Sky Nha Trang,Nha Trang
466,Quy Nhơn Balahouse,Quy Nhơn
550,VES - PA Luxury Hotel,Đà Lạt
433,MyFa House,Huế
424,Minh Hien Hotel,Phan Thiết
28,Best Western Premier Sonasea Phu Quoc,Phú Quốc
522,TTR An Nam Apart Hotel,Đà Lạt
1,AN Boutique Hotel - STAY 24H,Đà Lạt
64,FLC Sea Tower Quy Nhơn - Enochnguyen,Quy Nhơn
81,Halina Hotel and Apartment,Đà Nẵng
580,Đức Trọng Hotel,Vũng Tàu
529,Thanh Van 1 Hotel,Hội An
406,"Làng Bình An, Hồ Tuyền Lâm Đà Lạt",Đà Lạt
453,Orchid Hotel,Huế
6,Allegro Hoi An . A Little Luxury Hotel & Spa,Hội An
119,"InterContinental Phu Quoc Long Beach Resort, an IHG Hotel",Phú Quốc
105,Hue Nino Hotel,Huế
516,TH Quy Nhơn Hotel,Quy Nhơn
450,Ocean Bay Phu Quoc Resort and Spa,Phú Quốc
85,Hoang Long Hotel Phan Thiết,Phan Thiết
547,Tâm Homestay,Huế
63,FLC SEA TOWER APARTMENT Minh Minh,Quy Nhơn
61,Everland Hotel,Đà Nẵng
91,Hoi An Riverside Villas & Apartments,Hội An
125,Khanh Uyen 3 Hotel,Đà Lạt
245,Khách sạn FLC Grand Quy Nhơn,Quy Nhơn
478,Rosetta Hotel Danang,Đà Nẵng
39,Cassia Cottage,Phú Quốc
426,Mira Eco Hotel Quy Nhơn,Quy Nhơn
197,Khu nghỉ dưỡng Pullman Phú Quốc,Phú Quốc
10,An Lâm Retreats Ninh Vân Bay,Nha Trang
173,Khu nghỉ dưỡng Le Palmier Hồ Tràm,Vũng Tàu
432,Muong Thanh Luxury Vien Trieu Nha Trang,Nha Trang
0,86 Homestay Phan Thiết,Phan Thiết
175,Khu nghỉ dưỡng Maia Quy Nhơn,Quy Nhơn
575,Zest Villas & Spa Hoi An,Hội An
58,Dendro Gold Hotel,Nha Trang
388,La Cactus Hotel 2,Quy Nhơn
422,Minh Boutique,Đà Nẵng
503,Silk Path Grand Huế Hotel & Spa,Huế
99,Hostel-John Cafe and Beer,Đà Lạt
287,Khách sạn Marigold Đà Lạt,Đà Lạt
93,Hoian Central Hotel,Hội An
472,Raon Villa - STAY 24H,Đà Lạt
554,Vias Hotel Vung Tau,Vũng Tàu
293,Khách sạn Merperle Beach Nha Trang,Nha Trang
389,La Casa Boutique Hotel,Vũng Tàu
66,Fati Boutique Hotel & Apartment,Vũng Tàu
154,Khu nghỉ dưỡng Centara Mirage Mũi Né,Phan Thiết
429,Mulberry Collection Silk Village,Hội An
465,Putin Nha Trang Hotel,Nha Trang
26,Bazan Hotel Dalat - STAY 24H,Đà Lạt
572,Vuon Xuan Hotel - STAY 24H,Đà Lạt
506,Son Hoi An Boutique Hotel & Spa,Hội An
526,Thanh Hoang Chau Hotel Da Nang,Đà Nẵng
541,The Song Vung Tau Apartment,Vũng Tàu
488,Sea Castle 2 Hotel Da Nang,Đà Nẵng
470,Raon Dalat - STAY 24H,Đà Lạt
486,Salinda Resort Phu Quoc - Sparkling Wine Breakfast,Phú Quốc
574,White Lotus Hue Hotel,Huế
517,TMS Hotel Da Nang Beach,Đà Nẵng
393,Laluna Hoi An Riverside Hotel & Spa,Hội An
186,Khu nghỉ dưỡng Naman Retreat Đà Nẵng,Đà Nẵng
157,Khu nghỉ dưỡng Crowne Plaza Phú Quốc Starbay,Phú Quốc
46,Cozy Savvy Boutique Hotel Hoi An,Hội An
577,Đà Nẵng - Mikazuki Japanese Resorts & Spa,Đà Nẵng
483,SOLEIL BOUTIQUE,Huế
531,The Dream Resort & Spa,Phan Thiết
382,L'Azure Resort & Spa Phú Quốc,Phú Quốc
390,La Sera Hotel,Nha Trang
2,ANRIZON HOTEL NHA TRANG,Nha Trang
88,Hoi An Golden Holiday Hotel & Spa,Hội An
47,Crony Villa - STAY 24H,Hội An
60,Emerald Bay Hotel & Spa,Nha Trang
104,Hue Four Seasons Hotel,Huế
257,Khách sạn HAIAN Riverfront Đà Nẵng,Đà Nẵng
570,Virgo Hotel Nha Trang,Nha Trang
498,Sekong Hotel Da Nang,Đà Nẵng
543,Tigon Dalat Hostel,Đà Lạt
187,Khu nghỉ dưỡng New World  Phú Quốc,Phú Quốc
234,Khách sạn CANVAS Đà Nẵng Beach,Đà Nẵng
79,HOI AN HEART LODGE,Hội An
326,Khách sạn Radisson Đà Nẵng,Đà Nẵng
89,Hoi An Odyssey Hotel & Spa,Hội An
315,Khách sạn Paradise Đà Lạt,Đà Lạt
35,Bondi Backpackers Nhatrang,Nha Trang
578,Đà Nẵng Marriott Resort & Spa,Đà Nẵng
52,Daisy Garden Villa Hoi An,Hội An
96,Homestay Song Ngọc Phan Thiết,Phan Thiết
166,Khu nghỉ dưỡng Holiday Inn Hồ Tràm,Vũng Tàu
434,Mövenpick Resort Phan Thiet,Phan Thiết
491,Sea Night Hotel,Phan Thiết
519,TMS Luxury Condotel Quy Nhơn,Quy Nhơn
512,Sunset Sanato Resort & Villas Phú Quốc,Phú Quốc
62,FLC City Hotel Beach Quy Nhơn,Quy Nhơn
469,Radisson Resort Phan Thiet,Phan Thiết
134,Khu Nghỉ Dưỡng Wyndham Garden Cam Ranh,Nha Trang
84,Hoa My II Hotel,Hội An
346,Khách sạn Stillus Boutique Đà Lạt,Đà Lạt
244,Khách sạn Empyrean Nha Trang,Nha Trang
108,Huy Đạt Hotel,Phan Thiết
510,Sunny A Hotel,Huế
194,Khu nghỉ dưỡng Pax Ana Dốc Lết,Nha Trang
364,Khách sạn Vias Vũng Tàu,Vũng Tàu
229,Khách sạn Altara Suites Đà Nẵng,Đà Nẵng
32,Blooms Boutique Village,Hội An
